[
  {
    "turn_id": "9d5292c9-bf75-4ed2-8040-1d636b33ec84",
    "seq": 0,
    "ts": "2026-10-30T00:50:44.031116+00:00",
    "type": "turn_started",
    "state": "PLAN",
    "status": "info",
    "summary": "Baseline: retrieve once, generate once."
  },
  {
    "turn_id": "9d5292c9-bf75-4ed2-8040-1d636b33ec84",
    "seq": 1,
    "ts": "2026-10-30T00:50:44.032619+00:00",
    "type": "tool_call",
    "tool": "search_documents",
    "input": {
      "query": "Is Northfield HPC scratch storage backed up, and when is scratch data automatically removed?",
      "top_k": 5
    },
    "state": "ACT",
    "status": "ok",
    "attempt": 1,
    "summary": "Calling search_documents."
  },
  {
    "turn_id": "9d5292c9-bf75-4ed2-8040-1d636b33ec84",
    "seq": 2,
    "ts": "2026-10-30T00:50:44.056047+00:00",
    "type": "tool_result",
    "tool": "search_documents",
    "state": "OBSERVE",
    "status": "ok",
    "attempt": 1,
    "summary": "5 hits: Approved Cloud Services Registry p.2, Research Computing Governance and High-Performance Computing Policy p.5, Research Computing Governance and High-Performance Computing Policy p.9",
    "duration_ms": 23
  },
  {
    "turn_id": "9d5292c9-bf75-4ed2-8040-1d636b33ec84",
    "seq": 3,
    "ts": "2026-10-30T00:50:45.975664+00:00",
    "type": "evaluate",
    "state": "EVALUATE",
    "status": "info",
    "tokens": "[REDACTED]",
    "summary": "Model produced the answer.",
    "duration_ms": 1914
  },
  {
    "turn_id": "9d5292c9-bf75-4ed2-8040-1d636b33ec84",
    "seq": 4,
    "ts": "2026-10-30T00:50:45.986030+00:00",
    "type": "verify",
    "state": "VERIFY",
    "status": "ok",
    "summary": "All citations verified."
  },
  {
    "turn_id": "9d5292c9-bf75-4ed2-8040-1d636b33ec84",
    "seq": 5,
    "ts": "2026-10-30T00:50:45.988326+00:00",
    "type": "answer",
    "state": "EMIT",
    "status": "ok",
    "summary": "Northfield HPC scratch storage is not backed up, as stated in the policy: \"No backups are performed on scratch storage\" (E1). Additionally, scratch data is subject to a 60-day automatic purge policy, meaning it will be automatically removed after this period.",
    "stop_reason": "answered"
  },
  {
    "turn_id": "9d5292c9-bf75-4ed2-8040-1d636b33ec84",
    "seq": 6,
    "ts": "2026-10-30T00:50:45.990771+00:00",
    "type": "turn_completed",
    "status": "info",
    "summary": "Finished: answered.",
    "duration_ms": 1963,
    "stop_reason": "answered"
  }
]
