[
  {
    "turn_id": "2d91a441-a02b-4a32-89f6-957fd3a5991e",
    "seq": 0,
    "ts": "2026-10-30T00:45:56.870420+00:00",
    "type": "turn_started",
    "state": "PLAN",
    "status": "info",
    "summary": "Turn started."
  },
  {
    "turn_id": "2d91a441-a02b-4a32-89f6-957fd3a5991e",
    "seq": 1,
    "ts": "2026-10-30T00:45:57.956723+00:00",
    "type": "evaluate",
    "state": "EVALUATE",
    "status": "info",
    "tokens": "[REDACTED]",
    "summary": "Model decided the next action.",
    "duration_ms": 1083
  },
  {
    "turn_id": "2d91a441-a02b-4a32-89f6-957fd3a5991e",
    "seq": 2,
    "ts": "2026-10-30T00:45:57.960178+00:00",
    "type": "plan",
    "state": "PLAN",
    "status": "ok",
    "summary": "Plan: How many days of daily snapshots does Northfield Research Vault retain?",
    "sub_questions": [
      "How many days of daily snapshots does Northfield Research Vault retain?"
    ]
  },
  {
    "turn_id": "2d91a441-a02b-4a32-89f6-957fd3a5991e",
    "seq": 3,
    "ts": "2026-10-30T00:45:58.648351+00:00",
    "type": "evaluate",
    "state": "EVALUATE",
    "status": "info",
    "tokens": "[REDACTED]",
    "summary": "Model decided the next action.",
    "duration_ms": 684
  },
  {
    "turn_id": "2d91a441-a02b-4a32-89f6-957fd3a5991e",
    "seq": 4,
    "ts": "2026-10-30T00:45:58.652527+00:00",
    "type": "tool_call",
    "tool": "list_documents",
    "input": {},
    "state": "ACT",
    "status": "ok",
    "attempt": 1,
    "summary": "Calling list_documents."
  },
  {
    "turn_id": "2d91a441-a02b-4a32-89f6-957fd3a5991e",
    "seq": 5,
    "ts": "2026-10-30T00:45:58.658625+00:00",
    "type": "tool_result",
    "tool": "list_documents",
    "state": "OBSERVE",
    "result": {
      "hits": null,
      "weak": null,
      "pages": [],
      "error_code": null
    },
    "status": "ok",
    "attempt": 1,
    "summary": "10 documents.",
    "duration_ms": 7
  },
  {
    "turn_id": "2d91a441-a02b-4a32-89f6-957fd3a5991e",
    "seq": 6,
    "ts": "2026-10-30T00:45:59.483692+00:00",
    "type": "evaluate",
    "state": "EVALUATE",
    "status": "info",
    "tokens": "[REDACTED]",
    "summary": "Model decided the next action.",
    "duration_ms": 822
  },
  {
    "turn_id": "2d91a441-a02b-4a32-89f6-957fd3a5991e",
    "seq": 7,
    "ts": "2026-10-30T00:45:59.488683+00:00",
    "type": "tool_call",
    "tool": "search_documents",
    "input": {
      "query": "Northfield Research Vault daily snapshots retention"
    },
    "state": "ACT",
    "status": "ok",
    "attempt": 1,
    "summary": "Calling search_documents."
  },
  {
    "turn_id": "2d91a441-a02b-4a32-89f6-957fd3a5991e",
    "seq": 8,
    "ts": "2026-10-30T00:46:07.496048+00:00",
    "type": "tool_result",
    "tool": "search_documents",
    "state": "OBSERVE",
    "result": {
      "hits": 0,
      "weak": null,
      "pages": [],
      "error_code": "TIMEOUT"
    },
    "status": "retried",
    "attempt": 1,
    "summary": "TIMEOUT: search_documents timed out.",
    "duration_ms": 8006
  },
  {
    "turn_id": "2d91a441-a02b-4a32-89f6-957fd3a5991e",
    "seq": 9,
    "ts": "2026-10-30T00:46:07.701597+00:00",
    "type": "tool_call",
    "tool": "search_documents",
    "input": {
      "query": "Northfield Research Vault daily snapshots retention"
    },
    "state": "ACT",
    "status": "ok",
    "attempt": 2,
    "summary": "Calling search_documents."
  },
  {
    "turn_id": "2d91a441-a02b-4a32-89f6-957fd3a5991e",
    "seq": 10,
    "ts": "2026-10-30T00:46:07.731217+00:00",
    "type": "tool_result",
    "tool": "search_documents",
    "state": "OBSERVE",
    "result": {
      "hits": 6,
      "weak": false,
      "pages": [
        {
          "page": 3,
          "title": "Approved Cloud Services Registry",
          "document_id": "27f3b794-d69d-4bb0-a6f6-6addf4d71fd2"
        },
        {
          "page": 2,
          "title": "Approved Cloud Services Registry",
          "document_id": "27f3b794-d69d-4bb0-a6f6-6addf4d71fd2"
        },
        {
          "page": 10,
          "title": "Research Computing Governance and High-Performance Computing Policy",
          "document_id": "fe0335fe-bdc2-46eb-95fc-dd8ab311d9f1"
        },
        {
          "page": 5,
          "title": "Research Computing Governance and High-Performance Computing Policy",
          "document_id": "fe0335fe-bdc2-46eb-95fc-dd8ab311d9f1"
        },
        {
          "page": 5,
          "title": "Research Computing Governance and High-Performance Computing Policy",
          "document_id": "fe0335fe-bdc2-46eb-95fc-dd8ab311d9f1"
        },
        {
          "page": 1,
          "title": "Data Classification and Handling Standard",
          "document_id": "5c036da4-d529-4bf0-bd96-70cd63870642"
        }
      ],
      "error_code": null
    },
    "status": "ok",
    "attempt": 2,
    "summary": "6 hits: Approved Cloud Services Registry p.2, Approved Cloud Services Registry p.3, Data Classification and Handling Standard p.1, Research Computing Governance and High-Performance Computing Policy p.5",
    "duration_ms": 30
  },
  {
    "turn_id": "2d91a441-a02b-4a32-89f6-957fd3a5991e",
    "seq": 11,
    "ts": "2026-10-30T00:46:09.493726+00:00",
    "type": "evaluate",
    "state": "EVALUATE",
    "status": "info",
    "tokens": "[REDACTED]",
    "summary": "Model decided the next action.",
    "duration_ms": 1758
  },
  {
    "turn_id": "2d91a441-a02b-4a32-89f6-957fd3a5991e",
    "seq": 12,
    "ts": "2026-10-30T00:46:09.501234+00:00",
    "type": "synthesize",
    "state": "SYNTHESIZE",
    "status": "info",
    "summary": "Drafting the answer."
  },
  {
    "turn_id": "2d91a441-a02b-4a32-89f6-957fd3a5991e",
    "seq": 13,
    "ts": "2026-10-30T00:46:09.507147+00:00",
    "type": "verify",
    "state": "VERIFY",
    "status": "ok",
    "summary": "All citations verified.",
    "citations": [
      {
        "page": 3,
        "title": "Approved Cloud Services Registry",
        "verified": true,
        "document_id": "27f3b794-d69d-4bb0-a6f6-6addf4d71fd2"
      }
    ]
  },
  {
    "turn_id": "2d91a441-a02b-4a32-89f6-957fd3a5991e",
    "seq": 14,
    "ts": "2026-10-30T00:46:09.509402+00:00",
    "type": "answer",
    "state": "EMIT",
    "status": "ok",
    "summary": "The Northfield Research Vault retains daily snapshots for 35 days. Deleted files remain recoverable by project owners for 30 days and by OIT backup administrators for an additional five days. The Research Vault is intended as a working repository, not a permanent archive.",
    "citations": [
      {
        "page": 3,
        "title": "Approved Cloud Services Registry",
        "verified": true,
        "document_id": "27f3b794-d69d-4bb0-a6f6-6addf4d71fd2"
      }
    ],
    "stop_reason": "answered"
  },
  {
    "turn_id": "2d91a441-a02b-4a32-89f6-957fd3a5991e",
    "seq": 15,
    "ts": "2026-10-30T00:46:09.511144+00:00",
    "type": "turn_completed",
    "status": "info",
    "summary": "Finished: answered.",
    "duration_ms": 12646,
    "stop_reason": "answered"
  }
]
