[
  {
    "turn_id": "1fdccf15-0341-45ee-ad58-fd5c1e6c5385",
    "seq": 0,
    "ts": "2026-10-31T12:00:46.954226+00:00",
    "type": "turn_started",
    "state": "PLAN",
    "status": "info",
    "summary": "Baseline: retrieve once, generate once."
  },
  {
    "turn_id": "1fdccf15-0341-45ee-ad58-fd5c1e6c5385",
    "seq": 1,
    "ts": "2026-10-31T12:00:46.956307+00:00",
    "type": "tool_call",
    "tool": "search_documents",
    "input": {
      "query": "Where may I keep highly sensitive clinical study files in an internet-hosted file repository?",
      "top_k": 6
    },
    "state": "ACT",
    "status": "ok",
    "attempt": 1,
    "summary": "Calling search_documents."
  },
  {
    "turn_id": "1fdccf15-0341-45ee-ad58-fd5c1e6c5385",
    "seq": 2,
    "ts": "2026-10-31T12:00:46.985311+00:00",
    "type": "tool_result",
    "tool": "search_documents",
    "state": "OBSERVE",
    "result": {
      "hits": 6,
      "weak": false,
      "pages": [
        {
          "page": 3,
          "title": "Data Classification and Handling Standard",
          "document_id": "3c7da2a3-7d02-47d9-8c51-3b0afee8a264"
        },
        {
          "page": 2,
          "title": "Approved Cloud Services Registry",
          "document_id": "260ae5f4-b017-424b-a0ed-3e4d86c5b516"
        },
        {
          "page": 8,
          "title": "Research Computing Governance and High-Performance Computing Policy",
          "document_id": "5d99a373-70d4-4a38-8065-277a8530967d"
        },
        {
          "page": 8,
          "title": "Data Classification and Handling Standard",
          "document_id": "3c7da2a3-7d02-47d9-8c51-3b0afee8a264"
        },
        {
          "page": 8,
          "title": "Data Classification and Handling Standard",
          "document_id": "3c7da2a3-7d02-47d9-8c51-3b0afee8a264"
        },
        {
          "page": 10,
          "title": "Research Computing Governance and High-Performance Computing Policy",
          "document_id": "5d99a373-70d4-4a38-8065-277a8530967d"
        }
      ],
      "error_code": null
    },
    "status": "ok",
    "attempt": 1,
    "summary": "6 hits: Approved Cloud Services Registry p.2, Data Classification and Handling Standard p.3, Data Classification and Handling Standard p.8, Research Computing Governance and High-Performance Computing Policy p.8",
    "duration_ms": 28
  },
  {
    "turn_id": "1fdccf15-0341-45ee-ad58-fd5c1e6c5385",
    "seq": 3,
    "ts": "2026-10-31T12:00:49.198236+00:00",
    "type": "evaluate",
    "state": "EVALUATE",
    "status": "info",
    "tokens": "[REDACTED]",
    "summary": "Model produced the answer.",
    "duration_ms": 2210
  },
  {
    "turn_id": "1fdccf15-0341-45ee-ad58-fd5c1e6c5385",
    "seq": 4,
    "ts": "2026-10-31T12:00:49.203556+00:00",
    "type": "verify",
    "state": "VERIFY",
    "status": "ok",
    "summary": "All citations verified."
  },
  {
    "turn_id": "1fdccf15-0341-45ee-ad58-fd5c1e6c5385",
    "seq": 5,
    "ts": "2026-10-31T12:00:49.205057+00:00",
    "type": "answer",
    "state": "EMIT",
    "status": "ok",
    "summary": "The documents do not contain specific guidance on where to keep highly sensitive clinical study files in an internet-hosted file repository. However, they do outline general requirements for handling sensitive data. Level 4 material, which includes protected health information, must be stored exclus",
    "stop_reason": "answered"
  },
  {
    "turn_id": "1fdccf15-0341-45ee-ad58-fd5c1e6c5385",
    "seq": 6,
    "ts": "2026-10-31T12:00:49.206470+00:00",
    "type": "turn_completed",
    "status": "info",
    "summary": "Finished: answered.",
    "duration_ms": 2260,
    "stop_reason": "answered"
  }
]
