[
  {
    "turn_id": "b3b817dc-66f7-4beb-be19-d9dea002b5b5",
    "seq": 0,
    "ts": "2026-10-30T01:17:02.206640+00:00",
    "type": "turn_started",
    "state": "PLAN",
    "status": "info",
    "summary": "Turn started."
  },
  {
    "turn_id": "b3b817dc-66f7-4beb-be19-d9dea002b5b5",
    "seq": 1,
    "ts": "2026-10-30T01:17:03.257506+00:00",
    "type": "evaluate",
    "state": "EVALUATE",
    "status": "info",
    "tokens": "[REDACTED]",
    "summary": "Model decided the next action.",
    "duration_ms": 1047
  },
  {
    "turn_id": "b3b817dc-66f7-4beb-be19-d9dea002b5b5",
    "seq": 2,
    "ts": "2026-10-30T01:17:03.260422+00:00",
    "type": "plan",
    "state": "PLAN",
    "status": "ok",
    "summary": "Plan: Do Northfield users have to change their passwords?; What is the password change policy for Northfield users?; Is there a specific timeframe for password changes for Northfield users?",
    "sub_questions": [
      "Do Northfield users have to change their passwords?",
      "What is the password change policy for Northfield users?",
      "Is there a specific timeframe for password changes for Northfield users?"
    ]
  },
  {
    "turn_id": "b3b817dc-66f7-4beb-be19-d9dea002b5b5",
    "seq": 3,
    "ts": "2026-10-30T01:17:04.145909+00:00",
    "type": "evaluate",
    "state": "EVALUATE",
    "status": "info",
    "tokens": "[REDACTED]",
    "summary": "Model decided the next action.",
    "duration_ms": 882
  },
  {
    "turn_id": "b3b817dc-66f7-4beb-be19-d9dea002b5b5",
    "seq": 4,
    "ts": "2026-10-30T01:17:04.148135+00:00",
    "type": "tool_call",
    "tool": "list_documents",
    "input": {},
    "state": "ACT",
    "status": "ok",
    "attempt": 1,
    "summary": "Calling list_documents."
  },
  {
    "turn_id": "b3b817dc-66f7-4beb-be19-d9dea002b5b5",
    "seq": 5,
    "ts": "2026-10-30T01:17:04.151535+00:00",
    "type": "tool_result",
    "tool": "list_documents",
    "state": "OBSERVE",
    "result": {
      "hits": null,
      "weak": null,
      "pages": [],
      "error_code": null
    },
    "status": "ok",
    "attempt": 1,
    "summary": "14 documents.",
    "duration_ms": 4
  },
  {
    "turn_id": "b3b817dc-66f7-4beb-be19-d9dea002b5b5",
    "seq": 6,
    "ts": "2026-10-30T01:17:05.198386+00:00",
    "type": "evaluate",
    "state": "EVALUATE",
    "status": "info",
    "tokens": "[REDACTED]",
    "summary": "Model decided the next action.",
    "duration_ms": 1045
  },
  {
    "turn_id": "b3b817dc-66f7-4beb-be19-d9dea002b5b5",
    "seq": 7,
    "ts": "2026-10-30T01:17:05.201142+00:00",
    "type": "tool_call",
    "tool": "search_documents",
    "input": {
      "query": "Northfield password change policy"
    },
    "state": "ACT",
    "status": "ok",
    "attempt": 1,
    "summary": "Calling search_documents."
  },
  {
    "turn_id": "b3b817dc-66f7-4beb-be19-d9dea002b5b5",
    "seq": 8,
    "ts": "2026-10-30T01:17:05.232401+00:00",
    "type": "tool_result",
    "tool": "search_documents",
    "state": "OBSERVE",
    "result": {
      "hits": 6,
      "weak": false,
      "pages": [
        {
          "page": 1,
          "title": "Password and Credential Management Policy",
          "document_id": "5b6247de-ea3c-4e39-a7de-fedb99950c32"
        },
        {
          "page": 2,
          "title": "Password and Credential Management Policy",
          "document_id": "5b6247de-ea3c-4e39-a7de-fedb99950c32"
        },
        {
          "page": 2,
          "title": "Identity Security and Multi-Factor Authentication Standard",
          "document_id": "4e714aa6-0d76-47b5-90da-fe12c25005d3"
        },
        {
          "page": 2,
          "title": "Password and Credential Management Policy",
          "document_id": "5b6247de-ea3c-4e39-a7de-fedb99950c32"
        },
        {
          "page": 4,
          "title": "Identity Security and Multi-Factor Authentication Standard",
          "document_id": "4e714aa6-0d76-47b5-90da-fe12c25005d3"
        },
        {
          "page": 1,
          "title": "Password and Credential Management Policy",
          "document_id": "5b6247de-ea3c-4e39-a7de-fedb99950c32"
        }
      ],
      "error_code": null
    },
    "status": "ok",
    "attempt": 1,
    "summary": "6 hits: Identity Security and Multi-Factor Authentication Standard p.2, Identity Security and Multi-Factor Authentication Standard p.4, Password and Credential Management Policy p.1, Password and Credential Management Policy p.2",
    "duration_ms": 31
  },
  {
    "turn_id": "b3b817dc-66f7-4beb-be19-d9dea002b5b5",
    "seq": 9,
    "ts": "2026-10-30T01:17:05.239092+00:00",
    "type": "query_revised",
    "state": "REVISE",
    "status": "info",
    "summary": "Searching again for what the first results did not cover: password change every 90 days",
    "revision": {
      "reason": "uncovered_sub_question",
      "new_query": "password change every 90 days",
      "previous_query": "Northfield password change policy"
    }
  },
  {
    "turn_id": "b3b817dc-66f7-4beb-be19-d9dea002b5b5",
    "seq": 10,
    "ts": "2026-10-30T01:17:05.240896+00:00",
    "type": "tool_call",
    "tool": "search_documents",
    "input": {
      "query": "password change every 90 days"
    },
    "state": "ACT",
    "status": "ok",
    "attempt": 1,
    "summary": "Calling search_documents."
  },
  {
    "turn_id": "b3b817dc-66f7-4beb-be19-d9dea002b5b5",
    "seq": 11,
    "ts": "2026-10-30T01:17:05.260586+00:00",
    "type": "tool_result",
    "tool": "search_documents",
    "state": "OBSERVE",
    "result": {
      "hits": 6,
      "weak": false,
      "pages": [
        {
          "page": 2,
          "title": "Password and Credential Management Policy",
          "document_id": "5b6247de-ea3c-4e39-a7de-fedb99950c32"
        },
        {
          "page": 4,
          "title": "Identity Security and Multi-Factor Authentication Standard",
          "document_id": "4e714aa6-0d76-47b5-90da-fe12c25005d3"
        },
        {
          "page": 4,
          "title": "Identity Security and Multi-Factor Authentication Standard",
          "document_id": "4e714aa6-0d76-47b5-90da-fe12c25005d3"
        },
        {
          "page": 4,
          "title": "Identity Security and Multi-Factor Authentication Standard",
          "document_id": "4e714aa6-0d76-47b5-90da-fe12c25005d3"
        },
        {
          "page": 8,
          "title": "Account Lifecycle and Identity Provisioning Standard",
          "document_id": "851120d1-2ad1-465c-b60e-ed038fb72229"
        },
        {
          "page": 6,
          "title": "Password and Credential Management Policy",
          "document_id": "5b6247de-ea3c-4e39-a7de-fedb99950c32"
        }
      ],
      "error_code": null
    },
    "status": "ok",
    "attempt": 1,
    "summary": "6 hits: Account Lifecycle and Identity Provisioning Standard p.8, Identity Security and Multi-Factor Authentication Standard p.4, Password and Credential Management Policy p.2, Password and Credential Management Policy p.6",
    "duration_ms": 19
  },
  {
    "turn_id": "b3b817dc-66f7-4beb-be19-d9dea002b5b5",
    "seq": 12,
    "ts": "2026-10-30T01:17:06.940976+00:00",
    "type": "evaluate",
    "state": "EVALUATE",
    "status": "info",
    "tokens": "[REDACTED]",
    "summary": "Model decided the next action.",
    "duration_ms": 1676
  },
  {
    "turn_id": "b3b817dc-66f7-4beb-be19-d9dea002b5b5",
    "seq": 13,
    "ts": "2026-10-30T01:17:06.943984+00:00",
    "type": "synthesize",
    "state": "SYNTHESIZE",
    "status": "info",
    "summary": "Drafting the answer."
  },
  {
    "turn_id": "b3b817dc-66f7-4beb-be19-d9dea002b5b5",
    "seq": 14,
    "ts": "2026-10-30T01:17:06.951608+00:00",
    "type": "verify",
    "state": "VERIFY",
    "status": "ok",
    "summary": "All citations verified.",
    "citations": [
      {
        "page": 2,
        "title": "Password and Credential Management Policy",
        "verified": true,
        "document_id": "5b6247de-ea3c-4e39-a7de-fedb99950c32"
      }
    ]
  },
  {
    "turn_id": "b3b817dc-66f7-4beb-be19-d9dea002b5b5",
    "seq": 15,
    "ts": "2026-10-30T01:17:06.954247+00:00",
    "type": "answer",
    "state": "EMIT",
    "status": "ok",
    "summary": "Yes, Northfield users are required to change their passwords every 90 days. If they do not change their passwords within this timeframe, their accounts will be automatically locked and will require manual reactivation by the IT Service Desk.",
    "citations": [
      {
        "page": 2,
        "title": "Password and Credential Management Policy",
        "verified": true,
        "document_id": "5b6247de-ea3c-4e39-a7de-fedb99950c32"
      }
    ],
    "stop_reason": "answered"
  },
  {
    "turn_id": "b3b817dc-66f7-4beb-be19-d9dea002b5b5",
    "seq": 16,
    "ts": "2026-10-30T01:17:06.956525+00:00",
    "type": "turn_completed",
    "status": "info",
    "summary": "Finished: answered.",
    "duration_ms": 4756,
    "stop_reason": "answered"
  }
]
