[
  {
    "turn_id": "371672b9-2256-4ed6-b172-957c83e202a4",
    "seq": 0,
    "ts": "2026-10-31T11:56:40.795574+00:00",
    "type": "turn_started",
    "state": "PLAN",
    "status": "info",
    "summary": "Turn started."
  },
  {
    "turn_id": "371672b9-2256-4ed6-b172-957c83e202a4",
    "seq": 1,
    "ts": "2026-10-31T11:56:41.995382+00:00",
    "type": "evaluate",
    "state": "EVALUATE",
    "status": "info",
    "tokens": "[REDACTED]",
    "summary": "Model decided the next action.",
    "duration_ms": 1197
  },
  {
    "turn_id": "371672b9-2256-4ed6-b172-957c83e202a4",
    "seq": 2,
    "ts": "2026-10-31T11:56:41.998120+00:00",
    "type": "plan",
    "state": "PLAN",
    "status": "ok",
    "summary": "Plan: What are the guidelines for storing highly sensitive clinical study files?; Are there specific internet-hosted file repositories recommended for this purpose?; What security measures must be in place for such repositories?",
    "sub_questions": [
      "What are the guidelines for storing highly sensitive clinical study files?",
      "Are there specific internet-hosted file repositories recommended for this purpose?",
      "What security measures must be in place for such repositories?"
    ]
  },
  {
    "turn_id": "371672b9-2256-4ed6-b172-957c83e202a4",
    "seq": 3,
    "ts": "2026-10-31T11:56:43.370644+00:00",
    "type": "evaluate",
    "state": "EVALUATE",
    "status": "info",
    "tokens": "[REDACTED]",
    "summary": "Model decided the next action.",
    "duration_ms": 1370
  },
  {
    "turn_id": "371672b9-2256-4ed6-b172-957c83e202a4",
    "seq": 4,
    "ts": "2026-10-31T11:56:43.374003+00:00",
    "type": "tool_call",
    "tool": "search_documents",
    "input": {
      "query": "guidelines for storing highly sensitive clinical study files"
    },
    "state": "ACT",
    "status": "ok",
    "attempt": 1,
    "summary": "Calling search_documents."
  },
  {
    "turn_id": "371672b9-2256-4ed6-b172-957c83e202a4",
    "seq": 5,
    "ts": "2026-10-31T11:56:43.419725+00:00",
    "type": "tool_result",
    "tool": "search_documents",
    "state": "OBSERVE",
    "result": {
      "hits": 7,
      "weak": false,
      "pages": [
        {
          "page": 8,
          "title": "Data Classification and Handling Standard",
          "document_id": "3c7da2a3-7d02-47d9-8c51-3b0afee8a264"
        },
        {
          "page": 5,
          "title": "Password and Credential Management Policy",
          "document_id": "5b6247de-ea3c-4e39-a7de-fedb99950c32"
        },
        {
          "page": 8,
          "title": "Research Computing Governance and High-Performance Computing Policy",
          "document_id": "5d99a373-70d4-4a38-8065-277a8530967d"
        },
        {
          "page": 2,
          "title": "Approved Cloud Services Registry",
          "document_id": "260ae5f4-b017-424b-a0ed-3e4d86c5b516"
        },
        {
          "page": 8,
          "title": "Data Classification and Handling Standard",
          "document_id": "3c7da2a3-7d02-47d9-8c51-3b0afee8a264"
        },
        {
          "page": 3,
          "title": "Data Classification and Handling Standard",
          "document_id": "3c7da2a3-7d02-47d9-8c51-3b0afee8a264"
        }
      ],
      "error_code": null
    },
    "status": "ok",
    "attempt": 1,
    "summary": "7 hits: Approved Cloud Services Registry p.2, Data Classification and Handling Standard p.3, Data Classification and Handling Standard p.8, Identity Security and Multi-Factor Authentication Standard p.7",
    "duration_ms": 46
  },
  {
    "turn_id": "371672b9-2256-4ed6-b172-957c83e202a4",
    "seq": 6,
    "ts": "2026-10-31T11:56:43.421268+00:00",
    "type": "tool_call",
    "tool": "search_documents",
    "input": {
      "query": "Where may I keep highly sensitive clinical study files in an internet-hosted file repository?"
    },
    "scope": "literal_question",
    "state": "ACT",
    "status": "ok",
    "attempt": 1,
    "summary": "Also searching with your exact words."
  },
  {
    "turn_id": "371672b9-2256-4ed6-b172-957c83e202a4",
    "seq": 7,
    "ts": "2026-10-31T11:56:43.459614+00:00",
    "type": "tool_result",
    "tool": "search_documents",
    "state": "OBSERVE",
    "result": {
      "hits": 10,
      "weak": false,
      "pages": [
        {
          "page": 3,
          "title": "Data Classification and Handling Standard",
          "document_id": "3c7da2a3-7d02-47d9-8c51-3b0afee8a264"
        },
        {
          "page": 2,
          "title": "Approved Cloud Services Registry",
          "document_id": "260ae5f4-b017-424b-a0ed-3e4d86c5b516"
        },
        {
          "page": 8,
          "title": "Research Computing Governance and High-Performance Computing Policy",
          "document_id": "5d99a373-70d4-4a38-8065-277a8530967d"
        },
        {
          "page": 8,
          "title": "Data Classification and Handling Standard",
          "document_id": "3c7da2a3-7d02-47d9-8c51-3b0afee8a264"
        },
        {
          "page": 8,
          "title": "Data Classification and Handling Standard",
          "document_id": "3c7da2a3-7d02-47d9-8c51-3b0afee8a264"
        },
        {
          "page": 10,
          "title": "Research Computing Governance and High-Performance Computing Policy",
          "document_id": "5d99a373-70d4-4a38-8065-277a8530967d"
        }
      ],
      "error_code": null
    },
    "status": "ok",
    "attempt": 1,
    "summary": "10 hits: Approved Cloud Services Registry p.2, Data Classification and Handling Standard p.3, Data Classification and Handling Standard p.8, NIST SP 800-46r2: Telework, Remote Access and BYOD Security p.37",
    "duration_ms": 37
  },
  {
    "turn_id": "371672b9-2256-4ed6-b172-957c83e202a4",
    "seq": 8,
    "ts": "2026-10-31T11:56:45.014702+00:00",
    "type": "assessment",
    "state": "EVALUATE",
    "status": "info",
    "tokens": "[REDACTED]",
    "summary": "The answer depends on data level; asking.",
    "assessment": {
      "kinds": [
        {
          "page": 2,
          "label": "Level 3 material",
          "quote": "Level 3 material must not be placed in Northfield Collaboration Drive, a personal file-sharing account, or a bucket outside the university organization. Public ",
          "status": "verified",
          "document_id": "260ae5f4-b017-424b-a0ed-3e4d86c5b516"
        },
        {
          "page": 2,
          "label": "Level 4 material",
          "quote": "Level 4 material, including protected health information and export-controlled technical data, may be persisted only in the Secure Enclave Object Repository aft",
          "status": "verified",
          "document_id": "260ae5f4-b017-424b-a0ed-3e4d86c5b516"
        }
      ],
      "proposed": 2,
      "supported": 2,
      "answerable": false,
      "candidates": [
        "Level 3 material",
        "Level 4 material"
      ],
      "missing_slot": "data level",
      "answers_differ": true,
      "default_reading": null,
      "default_asserted": null,
      "value_in_question": null,
      "judge_answers_differ": true,
      "evidence_rules_differ": true
    }
  },
  {
    "turn_id": "371672b9-2256-4ed6-b172-957c83e202a4",
    "seq": 9,
    "ts": "2026-10-31T11:56:45.016784+00:00",
    "type": "clarification_requested",
    "input": {
      "options": [
        "Level 3 material",
        "Level 4 material"
      ],
      "question": "Which one do you mean: Level 3 material or Level 4 material?"
    },
    "state": "CLARIFY",
    "status": "info",
    "summary": "Which one do you mean: Level 3 material or Level 4 material?"
  },
  {
    "turn_id": "371672b9-2256-4ed6-b172-957c83e202a4",
    "seq": 10,
    "ts": "2026-10-31T11:56:45.018208+00:00",
    "type": "turn_completed",
    "status": "info",
    "summary": "Finished: clarification_needed.",
    "duration_ms": 4236,
    "stop_reason": "clarification_needed"
  }
]
