[
  {
    "turn_id": "310e5915-8239-4781-9072-1b2e36ebe048",
    "seq": 0,
    "ts": "2026-10-31T11:57:30.503080+00:00",
    "type": "turn_started",
    "state": "PLAN",
    "status": "info",
    "summary": "Baseline: retrieve once, generate once."
  },
  {
    "turn_id": "310e5915-8239-4781-9072-1b2e36ebe048",
    "seq": 1,
    "ts": "2026-10-31T11:57:30.504278+00:00",
    "type": "tool_call",
    "tool": "search_documents",
    "input": {
      "query": "A researcher has Level 3 confidential pre-publication data. What encryption is required at rest, and may the researcher paste it into a public consumer AI tool?",
      "top_k": 6
    },
    "state": "ACT",
    "status": "ok",
    "attempt": 1,
    "summary": "Calling search_documents."
  },
  {
    "turn_id": "310e5915-8239-4781-9072-1b2e36ebe048",
    "seq": 2,
    "ts": "2026-10-31T11:57:30.536825+00:00",
    "type": "tool_result",
    "tool": "search_documents",
    "state": "OBSERVE",
    "result": {
      "hits": 6,
      "weak": false,
      "pages": [
        {
          "page": 3,
          "title": "Generative AI and Large Language Model Usage Guidance",
          "document_id": "dc46dc44-c0b5-40fe-8e4c-338d043f4421"
        },
        {
          "page": 8,
          "title": "Data Classification and Handling Standard",
          "document_id": "3c7da2a3-7d02-47d9-8c51-3b0afee8a264"
        },
        {
          "page": 5,
          "title": "Generative AI and Large Language Model Usage Guidance",
          "document_id": "dc46dc44-c0b5-40fe-8e4c-338d043f4421"
        },
        {
          "page": 5,
          "title": "Data Classification and Handling Standard",
          "document_id": "3c7da2a3-7d02-47d9-8c51-3b0afee8a264"
        },
        {
          "page": 3,
          "title": "Data Classification and Handling Standard",
          "document_id": "3c7da2a3-7d02-47d9-8c51-3b0afee8a264"
        },
        {
          "page": 5,
          "title": "Generative AI and Large Language Model Usage Guidance",
          "document_id": "dc46dc44-c0b5-40fe-8e4c-338d043f4421"
        }
      ],
      "error_code": null
    },
    "status": "ok",
    "attempt": 1,
    "summary": "6 hits: Data Classification and Handling Standard p.3, Data Classification and Handling Standard p.5, Data Classification and Handling Standard p.8, Generative AI and Large Language Model Usage Guidance p.3",
    "duration_ms": 33
  },
  {
    "turn_id": "310e5915-8239-4781-9072-1b2e36ebe048",
    "seq": 3,
    "ts": "2026-10-31T11:57:32.386964+00:00",
    "type": "evaluate",
    "state": "EVALUATE",
    "status": "info",
    "tokens": "[REDACTED]",
    "summary": "Model produced the answer.",
    "duration_ms": 1847
  },
  {
    "turn_id": "310e5915-8239-4781-9072-1b2e36ebe048",
    "seq": 4,
    "ts": "2026-10-31T11:57:32.399604+00:00",
    "type": "verify",
    "state": "VERIFY",
    "status": "ok",
    "summary": "All citations verified."
  },
  {
    "turn_id": "310e5915-8239-4781-9072-1b2e36ebe048",
    "seq": 5,
    "ts": "2026-10-31T11:57:32.401918+00:00",
    "type": "answer",
    "state": "EMIT",
    "status": "ok",
    "summary": "A researcher with Level 3 confidential pre-publication data must use AES-256 or equivalent encryption at rest. Additionally, the researcher is prohibited from pasting this data into any public consumer AI tool. Specifically, it is stated that \"Faculty and staff must not input, paste, or upload Level",
    "stop_reason": "answered"
  },
  {
    "turn_id": "310e5915-8239-4781-9072-1b2e36ebe048",
    "seq": 6,
    "ts": "2026-10-31T11:57:32.404321+00:00",
    "type": "turn_completed",
    "status": "info",
    "summary": "Finished: answered.",
    "duration_ms": 1905,
    "stop_reason": "answered"
  }
]
