[
  {
    "turn_id": "dd4cfe63-e553-42af-92d6-8592a20d4d09",
    "seq": 0,
    "ts": "2026-10-30T00:06:06.835903+00:00",
    "type": "turn_started",
    "state": "PLAN",
    "status": "info",
    "summary": "Baseline: retrieve once, generate once."
  },
  {
    "turn_id": "dd4cfe63-e553-42af-92d6-8592a20d4d09",
    "seq": 1,
    "ts": "2026-10-30T00:06:06.837151+00:00",
    "type": "tool_call",
    "tool": "search_documents",
    "input": {
      "query": "Where may I keep highly sensitive clinical study files in an internet-hosted file repository?",
      "top_k": 5
    },
    "state": "ACT",
    "status": "ok",
    "attempt": 1,
    "summary": "Calling search_documents."
  },
  {
    "turn_id": "dd4cfe63-e553-42af-92d6-8592a20d4d09",
    "seq": 2,
    "ts": "2026-10-30T00:06:06.855178+00:00",
    "type": "tool_result",
    "tool": "search_documents",
    "state": "OBSERVE",
    "status": "ok",
    "attempt": 1,
    "summary": "5 hits: Approved Cloud Services Registry p.1, Approved Cloud Services Registry p.2, Approved Cloud Services Registry p.3, Data Classification and Handling Standard p.3",
    "duration_ms": 18
  },
  {
    "turn_id": "dd4cfe63-e553-42af-92d6-8592a20d4d09",
    "seq": 3,
    "ts": "2026-10-30T00:06:10.354300+00:00",
    "type": "evaluate",
    "state": "EVALUATE",
    "status": "info",
    "tokens": "[REDACTED]",
    "summary": "Model produced the answer.",
    "duration_ms": 3496
  },
  {
    "turn_id": "dd4cfe63-e553-42af-92d6-8592a20d4d09",
    "seq": 4,
    "ts": "2026-10-30T00:06:10.359129+00:00",
    "type": "verify",
    "state": "VERIFY",
    "status": "ok",
    "summary": "All citations verified."
  },
  {
    "turn_id": "dd4cfe63-e553-42af-92d6-8592a20d4d09",
    "seq": 5,
    "ts": "2026-10-30T00:06:10.360071+00:00",
    "type": "answer",
    "state": "EMIT",
    "status": "ok",
    "summary": "To keep highly sensitive clinical study files in an internet-hosted file repository, you should use the Secure Enclave Object Repository after obtaining written approval from the Chief Information Security Officer (CISO). This repository is specifically designed for Level 4 material, which includes ",
    "stop_reason": "answered"
  },
  {
    "turn_id": "dd4cfe63-e553-42af-92d6-8592a20d4d09",
    "seq": 6,
    "ts": "2026-10-30T00:06:10.360911+00:00",
    "type": "turn_completed",
    "status": "info",
    "summary": "Finished: answered.",
    "duration_ms": 3527,
    "stop_reason": "answered"
  }
]
