[
  {
    "turn_id": "80db4f29-0f30-4e51-a538-e50c6542f07e",
    "seq": 0,
    "ts": "2026-10-30T00:45:42.824068+00:00",
    "type": "turn_started",
    "state": "PLAN",
    "status": "info",
    "summary": "Turn started."
  },
  {
    "turn_id": "80db4f29-0f30-4e51-a538-e50c6542f07e",
    "seq": 1,
    "ts": "2026-10-30T00:45:43.857212+00:00",
    "type": "evaluate",
    "state": "EVALUATE",
    "status": "info",
    "tokens": "[REDACTED]",
    "summary": "Model decided the next action.",
    "duration_ms": 1031
  },
  {
    "turn_id": "80db4f29-0f30-4e51-a538-e50c6542f07e",
    "seq": 2,
    "ts": "2026-10-30T00:45:43.860144+00:00",
    "type": "plan",
    "state": "PLAN",
    "status": "ok",
    "summary": "Plan: Do Northfield users have to change their passwords?; What is the password change policy for Northfield users?; Is there a specific timeframe for password changes for Northfield users?",
    "sub_questions": [
      "Do Northfield users have to change their passwords?",
      "What is the password change policy for Northfield users?",
      "Is there a specific timeframe for password changes for Northfield users?"
    ]
  },
  {
    "turn_id": "80db4f29-0f30-4e51-a538-e50c6542f07e",
    "seq": 3,
    "ts": "2026-10-30T00:45:44.567356+00:00",
    "type": "evaluate",
    "state": "EVALUATE",
    "status": "info",
    "tokens": "[REDACTED]",
    "summary": "Model decided the next action.",
    "duration_ms": 704
  },
  {
    "turn_id": "80db4f29-0f30-4e51-a538-e50c6542f07e",
    "seq": 4,
    "ts": "2026-10-30T00:45:44.570717+00:00",
    "type": "tool_call",
    "tool": "search_documents",
    "input": {
      "query": "Northfield users password change policy"
    },
    "state": "ACT",
    "status": "ok",
    "attempt": 1,
    "summary": "Calling search_documents."
  },
  {
    "turn_id": "80db4f29-0f30-4e51-a538-e50c6542f07e",
    "seq": 5,
    "ts": "2026-10-30T00:45:44.600293+00:00",
    "type": "tool_result",
    "tool": "search_documents",
    "state": "OBSERVE",
    "result": {
      "hits": 6,
      "weak": false,
      "pages": [
        {
          "page": 2,
          "title": "Password and Credential Management Policy",
          "document_id": "bf8f2146-13fb-47ae-9cb7-524eda9c1dfc"
        },
        {
          "page": 3,
          "title": "Identity Security and Multi-Factor Authentication Standard",
          "document_id": "2829897e-304a-4c0a-93c0-fa14a8b2c311"
        },
        {
          "page": 1,
          "title": "Password and Credential Management Policy",
          "document_id": "bf8f2146-13fb-47ae-9cb7-524eda9c1dfc"
        },
        {
          "page": 2,
          "title": "Password and Credential Management Policy",
          "document_id": "bf8f2146-13fb-47ae-9cb7-524eda9c1dfc"
        },
        {
          "page": 1,
          "title": "Password and Credential Management Policy",
          "document_id": "bf8f2146-13fb-47ae-9cb7-524eda9c1dfc"
        },
        {
          "page": 5,
          "title": "Password and Credential Management Policy",
          "document_id": "bf8f2146-13fb-47ae-9cb7-524eda9c1dfc"
        }
      ],
      "error_code": null
    },
    "status": "ok",
    "attempt": 1,
    "summary": "6 hits: Identity Security and Multi-Factor Authentication Standard p.3, Password and Credential Management Policy p.1, Password and Credential Management Policy p.2, Password and Credential Management Policy p.5",
    "duration_ms": 30
  },
  {
    "turn_id": "80db4f29-0f30-4e51-a538-e50c6542f07e",
    "seq": 6,
    "ts": "2026-10-30T00:45:46.939388+00:00",
    "type": "evaluate",
    "state": "EVALUATE",
    "status": "info",
    "tokens": "[REDACTED]",
    "summary": "Model decided the next action.",
    "duration_ms": 2329
  },
  {
    "turn_id": "80db4f29-0f30-4e51-a538-e50c6542f07e",
    "seq": 7,
    "ts": "2026-10-30T00:45:46.945310+00:00",
    "type": "synthesize",
    "state": "SYNTHESIZE",
    "status": "info",
    "summary": "Drafting the answer."
  },
  {
    "turn_id": "80db4f29-0f30-4e51-a538-e50c6542f07e",
    "seq": 8,
    "ts": "2026-10-30T00:45:46.954889+00:00",
    "type": "verify",
    "state": "VERIFY",
    "status": "ok",
    "summary": "All citations verified.",
    "citations": [
      {
        "page": 2,
        "title": "Password and Credential Management Policy",
        "verified": true,
        "document_id": "bf8f2146-13fb-47ae-9cb7-524eda9c1dfc"
      }
    ]
  },
  {
    "turn_id": "80db4f29-0f30-4e51-a538-e50c6542f07e",
    "seq": 9,
    "ts": "2026-10-30T00:45:46.957253+00:00",
    "type": "answer",
    "state": "EMIT",
    "status": "ok",
    "summary": "Yes, Northfield users are required to change their passwords every 90 days. According to the Password and Credential Management Policy, \"All university accounts \u2014 including student, faculty, staff, and service accounts \u2014 must change passwords every 90 days\" (E1). Additionally, accounts that fail to ",
    "citations": [
      {
        "page": 2,
        "title": "Password and Credential Management Policy",
        "verified": true,
        "document_id": "bf8f2146-13fb-47ae-9cb7-524eda9c1dfc"
      }
    ],
    "stop_reason": "answered"
  },
  {
    "turn_id": "80db4f29-0f30-4e51-a538-e50c6542f07e",
    "seq": 10,
    "ts": "2026-10-30T00:45:46.958839+00:00",
    "type": "turn_completed",
    "status": "info",
    "summary": "Finished: answered.",
    "duration_ms": 4139,
    "stop_reason": "answered"
  }
]
