[
  {
    "turn_id": "e61c9dd8-2737-46c6-ae6e-451c5d84cb3c",
    "seq": 0,
    "ts": "2026-10-31T12:00:19.455607+00:00",
    "type": "turn_started",
    "state": "PLAN",
    "status": "info",
    "summary": "Baseline: retrieve once, generate once."
  },
  {
    "turn_id": "e61c9dd8-2737-46c6-ae6e-451c5d84cb3c",
    "seq": 1,
    "ts": "2026-10-31T12:00:19.457208+00:00",
    "type": "tool_call",
    "tool": "search_documents",
    "input": {
      "query": "Is Northfield HPC scratch storage backed up, and when is scratch data automatically removed?",
      "top_k": 6
    },
    "state": "ACT",
    "status": "ok",
    "attempt": 1,
    "summary": "Calling search_documents."
  },
  {
    "turn_id": "e61c9dd8-2737-46c6-ae6e-451c5d84cb3c",
    "seq": 2,
    "ts": "2026-10-31T12:00:19.485849+00:00",
    "type": "tool_result",
    "tool": "search_documents",
    "state": "OBSERVE",
    "result": {
      "hits": 6,
      "weak": false,
      "pages": [
        {
          "page": 5,
          "title": "Research Computing Governance and High-Performance Computing Policy",
          "document_id": "5d99a373-70d4-4a38-8065-277a8530967d"
        },
        {
          "page": 9,
          "title": "Research Computing Governance and High-Performance Computing Policy",
          "document_id": "5d99a373-70d4-4a38-8065-277a8530967d"
        },
        {
          "page": 9,
          "title": "Research Computing Governance and High-Performance Computing Policy",
          "document_id": "5d99a373-70d4-4a38-8065-277a8530967d"
        },
        {
          "page": 8,
          "title": "Research Computing Governance and High-Performance Computing Policy",
          "document_id": "5d99a373-70d4-4a38-8065-277a8530967d"
        },
        {
          "page": 6,
          "title": "Research Computing Governance and High-Performance Computing Policy",
          "document_id": "5d99a373-70d4-4a38-8065-277a8530967d"
        },
        {
          "page": 46,
          "title": "NIST SP 800-46r2: Telework, Remote Access and BYOD Security",
          "document_id": "e8f3c161-af94-466c-816f-7ca8cfe54899"
        }
      ],
      "error_code": null
    },
    "status": "ok",
    "attempt": 1,
    "summary": "6 hits: NIST SP 800-46r2: Telework, Remote Access and BYOD Security p.46, Research Computing Governance and High-Performance Computing Policy p.5, Research Computing Governance and High-Performance Computing Policy p.6, Research Computing Governance and High-Performance Computing Policy p.8",
    "duration_ms": 29
  },
  {
    "turn_id": "e61c9dd8-2737-46c6-ae6e-451c5d84cb3c",
    "seq": 3,
    "ts": "2026-10-31T12:00:21.244687+00:00",
    "type": "evaluate",
    "state": "EVALUATE",
    "status": "info",
    "tokens": "[REDACTED]",
    "summary": "Model produced the answer.",
    "duration_ms": 1757
  },
  {
    "turn_id": "e61c9dd8-2737-46c6-ae6e-451c5d84cb3c",
    "seq": 4,
    "ts": "2026-10-31T12:00:21.252052+00:00",
    "type": "verify",
    "state": "VERIFY",
    "status": "ok",
    "summary": "All citations verified."
  },
  {
    "turn_id": "e61c9dd8-2737-46c6-ae6e-451c5d84cb3c",
    "seq": 5,
    "ts": "2026-10-31T12:00:21.253662+00:00",
    "type": "answer",
    "state": "EMIT",
    "status": "ok",
    "summary": "Northfield HPC scratch storage is not backed up and is subject to a 60-day automatic purge policy. Users are responsible for migrating valuable results to project or archival storage, as \"No backups are performed on scratch storage\" and \"Data on scratch is subject to a 60-day automatic purge policy\"",
    "stop_reason": "answered"
  },
  {
    "turn_id": "e61c9dd8-2737-46c6-ae6e-451c5d84cb3c",
    "seq": 6,
    "ts": "2026-10-31T12:00:21.255149+00:00",
    "type": "turn_completed",
    "status": "info",
    "summary": "Finished: answered.",
    "duration_ms": 1807,
    "stop_reason": "answered"
  }
]
