[
  {
    "turn_id": "a7f3a00a-8f5d-4161-ba8f-420de6ff1947",
    "seq": 0,
    "ts": "2026-10-30T01:28:15.288932+00:00",
    "type": "turn_started",
    "state": "PLAN",
    "status": "info",
    "summary": "Turn started."
  },
  {
    "turn_id": "a7f3a00a-8f5d-4161-ba8f-420de6ff1947",
    "seq": 1,
    "ts": "2026-10-30T01:28:16.138005+00:00",
    "type": "evaluate",
    "state": "EVALUATE",
    "status": "info",
    "tokens": "[REDACTED]",
    "summary": "Model decided the next action.",
    "duration_ms": 846
  },
  {
    "turn_id": "a7f3a00a-8f5d-4161-ba8f-420de6ff1947",
    "seq": 2,
    "ts": "2026-10-30T01:28:16.140970+00:00",
    "type": "plan",
    "state": "PLAN",
    "status": "ok",
    "summary": "Plan: Is Northfield HPC scratch storage backed up?; When is scratch data automatically removed?",
    "sub_questions": [
      "Is Northfield HPC scratch storage backed up?",
      "When is scratch data automatically removed?"
    ]
  },
  {
    "turn_id": "a7f3a00a-8f5d-4161-ba8f-420de6ff1947",
    "seq": 3,
    "ts": "2026-10-30T01:28:17.344038+00:00",
    "type": "evaluate",
    "state": "EVALUATE",
    "status": "info",
    "tokens": "[REDACTED]",
    "summary": "Model decided the next action.",
    "duration_ms": 1200
  },
  {
    "turn_id": "a7f3a00a-8f5d-4161-ba8f-420de6ff1947",
    "seq": 4,
    "ts": "2026-10-30T01:28:17.347619+00:00",
    "type": "tool_call",
    "tool": "search_documents",
    "input": {
      "query": "Northfield HPC scratch storage backup"
    },
    "state": "ACT",
    "status": "ok",
    "attempt": 1,
    "summary": "Calling search_documents."
  },
  {
    "turn_id": "a7f3a00a-8f5d-4161-ba8f-420de6ff1947",
    "seq": 5,
    "ts": "2026-10-30T01:28:17.374098+00:00",
    "type": "tool_result",
    "tool": "search_documents",
    "state": "OBSERVE",
    "result": {
      "hits": 6,
      "weak": false,
      "pages": [
        {
          "page": 5,
          "title": "Research Computing Governance and High-Performance Computing Policy",
          "document_id": "5d99a373-70d4-4a38-8065-277a8530967d"
        },
        {
          "page": 3,
          "title": "Approved Cloud Services Registry",
          "document_id": "260ae5f4-b017-424b-a0ed-3e4d86c5b516"
        },
        {
          "page": 9,
          "title": "Research Computing Governance and High-Performance Computing Policy",
          "document_id": "5d99a373-70d4-4a38-8065-277a8530967d"
        },
        {
          "page": 9,
          "title": "Research Computing Governance and High-Performance Computing Policy",
          "document_id": "5d99a373-70d4-4a38-8065-277a8530967d"
        },
        {
          "page": 4,
          "title": "Data Classification and Handling Standard",
          "document_id": "3c7da2a3-7d02-47d9-8c51-3b0afee8a264"
        },
        {
          "page": 2,
          "title": "Approved Cloud Services Registry",
          "document_id": "260ae5f4-b017-424b-a0ed-3e4d86c5b516"
        }
      ],
      "error_code": null
    },
    "status": "ok",
    "attempt": 1,
    "summary": "6 hits: Approved Cloud Services Registry p.2, Approved Cloud Services Registry p.3, Data Classification and Handling Standard p.4, Research Computing Governance and High-Performance Computing Policy p.5",
    "duration_ms": 27
  },
  {
    "turn_id": "a7f3a00a-8f5d-4161-ba8f-420de6ff1947",
    "seq": 6,
    "ts": "2026-10-30T01:28:17.375841+00:00",
    "type": "query_revised",
    "state": "REVISE",
    "status": "info",
    "summary": "Searching again for what the first results did not cover: scratch data automatic removal Northfield HPC",
    "revision": {
      "reason": "uncovered_sub_question",
      "new_query": "scratch data automatic removal Northfield HPC",
      "previous_query": "Northfield HPC scratch storage backup"
    }
  },
  {
    "turn_id": "a7f3a00a-8f5d-4161-ba8f-420de6ff1947",
    "seq": 7,
    "ts": "2026-10-30T01:28:17.376836+00:00",
    "type": "tool_call",
    "tool": "search_documents",
    "input": {
      "query": "scratch data automatic removal Northfield HPC"
    },
    "state": "ACT",
    "status": "ok",
    "attempt": 1,
    "summary": "Calling search_documents."
  },
  {
    "turn_id": "a7f3a00a-8f5d-4161-ba8f-420de6ff1947",
    "seq": 8,
    "ts": "2026-10-30T01:28:17.394979+00:00",
    "type": "tool_result",
    "tool": "search_documents",
    "state": "OBSERVE",
    "result": {
      "hits": 6,
      "weak": false,
      "pages": [
        {
          "page": 2,
          "title": "Approved Cloud Services Registry",
          "document_id": "260ae5f4-b017-424b-a0ed-3e4d86c5b516"
        },
        {
          "page": 46,
          "title": "NIST SP 800-46r2: Telework, Remote Access and BYOD Security",
          "document_id": "e8f3c161-af94-466c-816f-7ca8cfe54899"
        },
        {
          "page": 5,
          "title": "Research Computing Governance and High-Performance Computing Policy",
          "document_id": "5d99a373-70d4-4a38-8065-277a8530967d"
        },
        {
          "page": 6,
          "title": "Data Classification and Handling Standard",
          "document_id": "3c7da2a3-7d02-47d9-8c51-3b0afee8a264"
        },
        {
          "page": 5,
          "title": "Research Computing Governance and High-Performance Computing Policy",
          "document_id": "5d99a373-70d4-4a38-8065-277a8530967d"
        },
        {
          "page": 8,
          "title": "Research Computing Governance and High-Performance Computing Policy",
          "document_id": "5d99a373-70d4-4a38-8065-277a8530967d"
        }
      ],
      "error_code": null
    },
    "status": "ok",
    "attempt": 1,
    "summary": "6 hits: Approved Cloud Services Registry p.2, Data Classification and Handling Standard p.6, NIST SP 800-46r2: Telework, Remote Access and BYOD Security p.46, Research Computing Governance and High-Performance Computing Policy p.5",
    "duration_ms": 18
  },
  {
    "turn_id": "a7f3a00a-8f5d-4161-ba8f-420de6ff1947",
    "seq": 9,
    "ts": "2026-10-30T01:28:19.608377+00:00",
    "type": "evaluate",
    "state": "EVALUATE",
    "status": "info",
    "tokens": "[REDACTED]",
    "summary": "Model decided the next action.",
    "duration_ms": 2209
  },
  {
    "turn_id": "a7f3a00a-8f5d-4161-ba8f-420de6ff1947",
    "seq": 10,
    "ts": "2026-10-30T01:28:19.614017+00:00",
    "type": "synthesize",
    "state": "SYNTHESIZE",
    "status": "info",
    "summary": "Drafting the answer."
  },
  {
    "turn_id": "a7f3a00a-8f5d-4161-ba8f-420de6ff1947",
    "seq": 11,
    "ts": "2026-10-30T01:28:19.623041+00:00",
    "type": "verify",
    "state": "VERIFY",
    "status": "ok",
    "summary": "All citations verified.",
    "citations": [
      {
        "page": 5,
        "title": "Research Computing Governance and High-Performance Computing Policy",
        "verified": true,
        "document_id": "5d99a373-70d4-4a38-8065-277a8530967d"
      }
    ]
  },
  {
    "turn_id": "a7f3a00a-8f5d-4161-ba8f-420de6ff1947",
    "seq": 12,
    "ts": "2026-10-30T01:28:19.625350+00:00",
    "type": "answer",
    "state": "EMIT",
    "status": "ok",
    "summary": "Northfield HPC scratch storage is not backed up, and data is subject to a 60-day automatic purge policy. Users must migrate any valuable results to project or archival storage before this period ends. \n- Scratch storage does not have any backup or replication services.\n- Users are responsible for en",
    "citations": [
      {
        "page": 5,
        "title": "Research Computing Governance and High-Performance Computing Policy",
        "verified": true,
        "document_id": "5d99a373-70d4-4a38-8065-277a8530967d"
      }
    ],
    "stop_reason": "answered"
  },
  {
    "turn_id": "a7f3a00a-8f5d-4161-ba8f-420de6ff1947",
    "seq": 13,
    "ts": "2026-10-30T01:28:19.627121+00:00",
    "type": "turn_completed",
    "status": "info",
    "summary": "Finished: answered.",
    "duration_ms": 4348,
    "stop_reason": "answered"
  }
]
