[
  {
    "turn_id": "8c7fd9f5-e5e9-411a-809e-bb6cd5b39a10",
    "seq": 0,
    "ts": "2026-10-31T11:58:08.718778+00:00",
    "type": "turn_started",
    "state": "PLAN",
    "status": "info",
    "summary": "Baseline: retrieve once, generate once."
  },
  {
    "turn_id": "8c7fd9f5-e5e9-411a-809e-bb6cd5b39a10",
    "seq": 1,
    "ts": "2026-10-31T11:58:08.720247+00:00",
    "type": "tool_call",
    "tool": "search_documents",
    "input": {
      "query": "Do Northfield users have to change their passwords every 90 days?",
      "top_k": 6
    },
    "state": "ACT",
    "status": "ok",
    "attempt": 1,
    "summary": "Calling search_documents."
  },
  {
    "turn_id": "8c7fd9f5-e5e9-411a-809e-bb6cd5b39a10",
    "seq": 2,
    "ts": "2026-10-31T11:58:08.746330+00:00",
    "type": "tool_result",
    "tool": "search_documents",
    "state": "OBSERVE",
    "result": {
      "hits": 6,
      "weak": false,
      "pages": [
        {
          "page": 2,
          "title": "Password and Credential Management Policy",
          "document_id": "5b6247de-ea3c-4e39-a7de-fedb99950c32"
        },
        {
          "page": 4,
          "title": "Identity Security and Multi-Factor Authentication Standard",
          "document_id": "4e714aa6-0d76-47b5-90da-fe12c25005d3"
        },
        {
          "page": 2,
          "title": "Password and Credential Management Policy",
          "document_id": "5b6247de-ea3c-4e39-a7de-fedb99950c32"
        },
        {
          "page": 4,
          "title": "Identity Security and Multi-Factor Authentication Standard",
          "document_id": "4e714aa6-0d76-47b5-90da-fe12c25005d3"
        },
        {
          "page": 4,
          "title": "Identity Security and Multi-Factor Authentication Standard",
          "document_id": "4e714aa6-0d76-47b5-90da-fe12c25005d3"
        },
        {
          "page": 2,
          "title": "Password and Credential Management Policy",
          "document_id": "5b6247de-ea3c-4e39-a7de-fedb99950c32"
        }
      ],
      "error_code": null
    },
    "status": "ok",
    "attempt": 1,
    "summary": "6 hits: Identity Security and Multi-Factor Authentication Standard p.4, Password and Credential Management Policy p.2",
    "duration_ms": 26
  },
  {
    "turn_id": "8c7fd9f5-e5e9-411a-809e-bb6cd5b39a10",
    "seq": 3,
    "ts": "2026-10-31T11:58:10.168234+00:00",
    "type": "evaluate",
    "state": "EVALUATE",
    "status": "info",
    "tokens": "[REDACTED]",
    "summary": "Model produced the answer.",
    "duration_ms": 1420
  },
  {
    "turn_id": "8c7fd9f5-e5e9-411a-809e-bb6cd5b39a10",
    "seq": 4,
    "ts": "2026-10-31T11:58:10.171123+00:00",
    "type": "verify",
    "state": "VERIFY",
    "status": "ok",
    "summary": "All citations verified."
  },
  {
    "turn_id": "8c7fd9f5-e5e9-411a-809e-bb6cd5b39a10",
    "seq": 5,
    "ts": "2026-10-31T11:58:10.172951+00:00",
    "type": "answer",
    "state": "EMIT",
    "status": "ok",
    "summary": "Yes, Northfield users are required to change their passwords every 90 days. According to the Password and Credential Management Policy, \"All university accounts \u2014 including student, faculty, staff, and service accounts \u2014 must change passwords every 90 days.\" Failure to do so will result in accounts ",
    "stop_reason": "answered"
  },
  {
    "turn_id": "8c7fd9f5-e5e9-411a-809e-bb6cd5b39a10",
    "seq": 6,
    "ts": "2026-10-31T11:58:10.174739+00:00",
    "type": "turn_completed",
    "status": "info",
    "summary": "Finished: answered.",
    "duration_ms": 1461,
    "stop_reason": "answered"
  }
]
