[
  {
    "turn_id": "1dd86f3c-4836-4fd4-b40b-458372b00686",
    "seq": 0,
    "ts": "2026-10-30T00:05:41.057356+00:00",
    "type": "turn_started",
    "state": "PLAN",
    "status": "info",
    "summary": "Baseline: retrieve once, generate once."
  },
  {
    "turn_id": "1dd86f3c-4836-4fd4-b40b-458372b00686",
    "seq": 1,
    "ts": "2026-10-30T00:05:41.059802+00:00",
    "type": "tool_call",
    "tool": "search_documents",
    "input": {
      "query": "Is Northfield HPC scratch storage backed up, and when is scratch data automatically removed?",
      "top_k": 5
    },
    "state": "ACT",
    "status": "ok",
    "attempt": 1,
    "summary": "Calling search_documents."
  },
  {
    "turn_id": "1dd86f3c-4836-4fd4-b40b-458372b00686",
    "seq": 2,
    "ts": "2026-10-30T00:05:41.079526+00:00",
    "type": "tool_result",
    "tool": "search_documents",
    "state": "OBSERVE",
    "status": "ok",
    "attempt": 1,
    "summary": "5 hits: Approved Cloud Services Registry p.2, Research Computing Governance and High-Performance Computing Policy p.5, Research Computing Governance and High-Performance Computing Policy p.9",
    "duration_ms": 20
  },
  {
    "turn_id": "1dd86f3c-4836-4fd4-b40b-458372b00686",
    "seq": 3,
    "ts": "2026-10-30T00:05:43.051693+00:00",
    "type": "evaluate",
    "state": "EVALUATE",
    "status": "info",
    "tokens": "[REDACTED]",
    "summary": "Model produced the answer.",
    "duration_ms": 1967
  },
  {
    "turn_id": "1dd86f3c-4836-4fd4-b40b-458372b00686",
    "seq": 4,
    "ts": "2026-10-30T00:05:43.061780+00:00",
    "type": "verify",
    "state": "VERIFY",
    "status": "ok",
    "summary": "All citations verified."
  },
  {
    "turn_id": "1dd86f3c-4836-4fd4-b40b-458372b00686",
    "seq": 5,
    "ts": "2026-10-30T00:05:43.064478+00:00",
    "type": "answer",
    "state": "EMIT",
    "status": "ok",
    "summary": "Northfield HPC scratch storage is not backed up and is subject to a 60-day automatic purge policy. Users are responsible for migrating valuable results to project or archival storage, as \"No backups are performed on scratch storage\" and \"Data on scratch is subject to a 60-day automatic purge policy\"",
    "stop_reason": "answered"
  },
  {
    "turn_id": "1dd86f3c-4836-4fd4-b40b-458372b00686",
    "seq": 6,
    "ts": "2026-10-30T00:05:43.066436+00:00",
    "type": "turn_completed",
    "status": "info",
    "summary": "Finished: answered.",
    "duration_ms": 2012,
    "stop_reason": "answered"
  }
]
